{"$schema":"https://json-schema.org/draft/2020-12/schema","title":"Evidence Workspace Envelope","type":"object","additionalProperties":false,"required":["record_kind","schema_version","workspace_id","kernel_pin","evidence_scope","evidence_packages","evidence_status_summary","unresolved_evidence_gaps","not_proven_by_workspace","created_at","producer"],"properties":{"record_kind":{"const":"evidence_workspace_envelope"},"schema_version":{"type":"string","minLength":1},"workspace_id":{"type":"string","minLength":1},"kernel_pin":{"type":"object"},"evidence_scope":{"type":"object","additionalProperties":false,"required":["scope_kind","scope_summary"],"properties":{"scope_kind":{"enum":["kernel_local_fixture_workspace","external_evidence_handoff","project_environment_attachment"]},"scope_summary":{"type":"string","minLength":1}}},"evidence_packages":{"type":"array","items":{"type":"object","additionalProperties":false,"required":["package_id","package_kind","package_ref","evidence_status"],"properties":{"package_id":{"type":"string","minLength":1},"package_kind":{"enum":["project_environment_profile","wordpress_context_evidence","elementor_project_availability_evidence","runtime_snapshot_evidence","responsive_runtime_evidence"]},"package_ref":{"type":"string","minLength":1},"evidence_status":{"enum":["not_provided","declared_not_available","provided_unvalidated","provided_schema_valid","implemented_awaiting_fixture_validation","validated_fixture","collected_runtime_evidence","rejected_invalid","insufficient_evidence","not_applicable_with_reason"]}}}},"evidence_status_summary":{"type":"object","additionalProperties":{"enum":["not_provided","declared_not_available","provided_unvalidated","provided_schema_valid","implemented_awaiting_fixture_validation","validated_fixture","collected_runtime_evidence","rejected_invalid","insufficient_evidence","not_applicable_with_reason"]},"minProperties":1},"unresolved_evidence_gaps":{"type":"array","items":{"type":"string","minLength":1}},"not_proven_by_workspace":{"type":"array","items":{"enum":["production_ready","builder_executed","downstream_contract_enforced","official_docs_fully_covered","cross_repo_integrated","project_gate_integrated"]},"minItems":1},"created_at":{"type":"string","minLength":1},"producer":{"type":"object","additionalProperties":false,"required":["producer_id","producer_type"],"properties":{"producer_id":{"type":"string","minLength":1},"producer_type":{"enum":["kernel_fixture","external_exporter","browser_collector","manual_operator"]}}},"assertions":{"type":"array","items":{"type":"string","minLength":1}}}}
