{"record_kind":"evidence_workspace_envelope","schema_version":"0.5.0","workspace_id":"evws-fixture-minimal-not-provided","kernel_pin":{"kernel_version":"0.1.0-mvk","kernel_source_commit":"2a764ea8c0ad79dfc8a7c9e75db1262d2bc65d9e","registry_manifest_ref":"kernel/registries/registry-manifest.v0.json","registry_manifest_sha256":"aaaaaaaaaaaaaaaaaaaaaaaaaaaaaaaaaaaaaaaaaaaaaaaaaaaaaaaaaaaaaaaa","compatibility_profile":{"profile_id":"fixture-profile","consumer_stage":"kernel-local-evidence-workspace-fixture"}},"evidence_scope":{"scope_kind":"kernel_local_fixture_workspace","scope_summary":"Minimal workspace fixture with no external evidence packages provided."},"evidence_packages":[],"evidence_status_summary":{"workspace":"not_provided"},"unresolved_evidence_gaps":["No external evidence package is attached in this fixture."],"not_proven_by_workspace":["production_ready","builder_executed","downstream_contract_enforced","official_docs_fully_covered","cross_repo_integrated","project_gate_integrated"],"created_at":"2026-07-08T00:00:00Z","producer":{"producer_id":"kernel-fixture","producer_type":"kernel_fixture"}}
